88;Buku Suatu Hari Dalam Hidupku Shafa Publika ;12;375;62900;Baru;Buku Suatu Hari Dalam Hidupku Shafa Publika .  Buku Sunnah. Shafa Publika;Tidak;j&tr | jner | tikir | wahana;https://alhaf.com/gambar/Shafa-Publika___Buku-Suatu-Hari-Dalam-Hidupku-Shafa-Publika-.jpg;Aqwam; Buku Sunnah
89;Buku Tenda Salju Shafa Publika ;6;500;44400;Baru;Buku Tenda Salju Shafa Publika .  Buku Sunnah. Shafa Publika;Tidak;j&tr | jner | tikir | wahana;https://alhaf.com/gambar/Shafa-Publika___Buku-Tenda-Salju-Shafa-Publika-.jpg;Aqwam; Buku Sunnah
90;Buku Chicken Soup For Muslim Sukses Publishing ;20;600;61300;Baru;Buku Chicken Soup For Muslim Sukses Publishing .  Buku Sunnah. Sukses Publishing;Tidak;j&tr | jner | tikir | wahana;https://alhaf.com/gambar/Sukses-Publishing___Buku-Chicken-Soup-For-Muslim-Sukses-Publishing-.jpg;Aqwam; Buku Sunnah
91;Buku Chicken Soup For Muslimah Sukses Publishing ;10;300;42100;Baru;Buku Chicken Soup For Muslimah Sukses Publishing .  Buku Sunnah. Sukses Publishing;Tidak;j&tr | jner | tikir | wahana;https://alhaf.com/gambar/Sukses-Publishing___Buku-Chicken-Soup-For-Muslimah-Sukses-Publishing-.jpg;Aqwam; Buku Sunnah
92;Buku Chicken Soup For Remaja Sukses Publishing ;7;300;53600;Baru;Buku Chicken Soup For Remaja Sukses Publishing .  Buku Sunnah. Sukses Publishing;Tidak;j&tr | jner | tikir | wahana;https://alhaf.com/gambar/Sukses-Publishing___Buku-Chicken-Soup-For-Remaja-Sukses-Publishing-.jpg;Aqwam; Buku Sunnah
93;Buku Jejak Cinta Lelaki Surga Sukses Publishing ;13;320;59000;Baru;Buku Jejak Cinta Lelaki Surga Sukses Publishing .  Buku Sunnah. Sukses Publishing;Tidak;j&tr | jner | tikir | wahana;https://alhaf.com/gambar/Sukses-Publishing___Buku-Jejak-Cinta-Lelaki-Surga-Sukses-Publishing-.jpg;Aqwam; Buku Sunnah
94;Buku Kisah-Kisah Cinta Kepada Allah Sukses Publishing ;13;600;102100;Baru;Buku Kisah-Kisah Cinta Kepada Allah Sukses Publishing .  Buku Sunnah. Sukses Publishing;Tidak;j&tr | jner | tikir | wahana;https://alhaf.com/gambar/Sukses-Publishing___Buku-Kisah-Kisah-Cinta-Kepada-Allah-Sukses-Publishing-.jpg;Aqwam; Buku Sunnah
95;Buku Memulai Hidup Baru Sukses Publishing ;10;300;49800;Baru;Buku Memulai Hidup Baru Sukses Publishing .  Buku Sunnah. Sukses Publishing;Tidak;j&tr | jner | tikir | wahana;https://alhaf.com/gambar/Sukses-Publishing___Buku-Memulai-Hidup-Baru-Sukses-Publishing-.jpg;Aqwam; Buku Sunnah
96;Buku Meraih Surga Motivasi Spesial Untuk Muslimah Sukses Publishing ;8;350;70600;Baru;Buku Meraih Surga Motivasi Spesial Untuk Muslimah Sukses Publishing .  Buku Sunnah. Sukses Publishing;Tidak;j&tr | jner | tikir | wahana;https://alhaf.com/gambar/Sukses-Publishing___Buku-Meraih-Surga-Motivasi-Spesial-Untuk-Muslimah-Sukses-Publishing-.jpg;Aqwam; Buku Sunnah
97;Mushaf Al Quran Tafsir Per Kata Tajwid Kode Arab Al Kaffah Ukuran A4 ;2;1400;78300;Baru;Mushaf Al Quran Tafsir Per Kata Tajwid Kode Arab Al Kaffah Ukuran A4 .  Buku Sunnah. Sukses Publishing;Tidak;j&tr | jner | tikir | wahana;https://alhaf.com/gambar/Sukses-Publishing___Mushaf-Al-Quran-Tafsir-Per-Kata-Tajwid-Kode-Arab-Al-Kaffah-Ukuran-A4-.jpg;Aqwam; Buku Sunnah
98;Buku Perempuan-Perempuan Hebat Di Sekitar Nabi Shalallahu Alaihi Wa Salam Sukses Publishing ;10;400;46700;Baru;Buku Perempuan-Perempuan Hebat Di Sekitar Nabi Shalallahu Alaihi Wa Salam Sukses Publishing .  Buku Sunnah. Sukses Publishing;Tidak;j&tr | jner | tikir | wahana;https://alhaf.com/gambar/Sukses-Publishing___Buku-Perempuan-Perempuan-Hebat-Di-Sekitar-Nabi-Shalallahu-Alaihi-Wa-Salam-Sukses-Publishing-.jpg;Aqwam; Buku Sunnah
99;Buku Jurus Sehat Rasulullah Dr Zaidul Akbar Syamil ;19;550;78300;Baru;Buku Jurus Sehat Rasulullah Dr Zaidul Akbar Syamil .  Buku Sunnah. Syamil Quran;Tidak;j&tr | jner | tikir | wahana;https://alhaf.com/gambar/Syamil-Quran___Buku-Jurus-Sehat-Rasulullah-Dr-Zaidul-Akbar-Syamil-.jpg;Aqwam; Buku Sunnah
100;Buku 40 Pesan Nabi Untuk Setiap Muslim Taqiya ;5;400;36700;Baru;Buku 40 Pesan Nabi Untuk Setiap Muslim Taqiya .  Buku Sunnah. Taqiya ;Tidak;j&tr | jner | tikir | wahana;https://alhaf.com/gambar/Taqiya-___Buku-40-Pesan-Nabi-Untuk-Setiap-Muslim-Taqiya-.jpg;Aqwam; Buku Sunnah
101;Buku 9 Pesan Terakhir Rasulullah Taqiya ;2;200;29000;Baru;Buku 9 Pesan Terakhir Rasulullah Taqiya .  Buku Sunnah. Taqiya ;Tidak;j&tr | jner | tikir | wahana;https://alhaf.com/gambar/Taqiya-___Buku-9-Pesan-Terakhir-Rasulullah-Taqiya-.jpg;Aqwam; Buku Sunnah
102;Buku Dikejar Rezeki Dari Sedekah Taqiya ;38;400;52100;Baru;Buku Dikejar Rezeki Dari Sedekah Taqiya .  Buku Sunnah. Taqiya ;Tidak;j&tr | jner | tikir | wahana;https://alhaf.com/gambar/Taqiya-___Buku-Dikejar-Rezeki-Dari-Sedekah-Taqiya-.jpg;Aqwam; Buku Sunnah
103;Buku La Tahzan For Women Taqiya ;18;500;52100;Baru;Buku La Tahzan For Women Taqiya .  Buku Sunnah. Taqiya ;Tidak;j&tr | jner | tikir | wahana;https://alhaf.com/gambar/Taqiya-___Buku-La-Tahzan-For-Women-Taqiya-.jpg;Aqwam; Buku Sunnah
104;Buku Panduan Lengkap Ilmu Tajwid Taqiya ;15;400;39800;Baru;Buku Panduan Lengkap Ilmu Tajwid Taqiya .  Buku Sunnah. Taqiya ;Tidak;j&tr | jner | tikir | wahana;https://alhaf.com/gambar/Taqiya-___Buku-Panduan-Lengkap-Ilmu-Tajwid-Taqiya-.jpg;Aqwam; Buku Sunnah
105;Buku Puasaku Sudah Benar Belum Taqiya ;19;500;36700;Baru;Buku Puasaku Sudah Benar Belum Taqiya .  Buku Sunnah. Taqiya ;Tidak;j&tr | jner | tikir | wahana;https://alhaf.com/gambar/Taqiya-___Buku-Puasaku-Sudah-Benar-Belum-Taqiya-.jpg;Aqwam; Buku Sunnah
106;Buku Rahasia Meraih Shalat Khusyu Taqiya ;10;300;36700;Baru;Buku Rahasia Meraih Shalat Khusyu Taqiya .  Buku Sunnah. Taqiya ;Tidak;j&tr | jner | tikir | wahana;https://alhaf.com/gambar/Taqiya-___Buku-Rahasia-Meraih-Shalat-Khusyu-Taqiya-.jpg;Aqwam; Buku Sunnah
107;Buku Shalatku Sudah Benar Belum Taqiya ;14;245;44400;Baru;Buku Shalatku Sudah Benar Belum Taqiya .  Buku Sunnah. Taqiya ;Tidak;j&tr | jner | tikir | wahana;https://alhaf.com/gambar/Taqiya-___Buku-Shalatku-Sudah-Benar-Belum-Taqiya-.jpg;Aqwam; Buku Sunnah
108;Buku Tazkiyatun Nafs Belajar Membersihkan Hati Taqiya ;21;350;32100;Baru;Buku Tazkiyatun Nafs Belajar Membersihkan Hati Taqiya .  Buku Sunnah. Taqiya ;Tidak;j&tr | jner | tikir | wahana;https://alhaf.com/gambar/Taqiya-___Buku-Tazkiyatun-Nafs-Belajar-Membersihkan-Hati-Taqiya-.jpg;Aqwam; Buku Sunnah
109;Buku Bekam Medik Thibbia Al Qowam ;24;600;122500;Baru;Buku Bekam Medik Thibbia Al Qowam .  Buku Sunnah. Thibbia;Tidak;j&tr | jner | tikir | wahana;https://alhaf.com/gambar/Thibbia___Buku-Bekam-Medik-Thibbia-Al-Qowam-.jpg;Aqwam; Buku Sunnah
110;Buku Bekam Untuk 7 Penyakit Kronis Thibbia ;22;300;44400;Baru;Buku Bekam Untuk 7 Penyakit Kronis Thibbia .  Buku Sunnah. Thibbia;Tidak;j&tr | jner | tikir | wahana;https://alhaf.com/gambar/Thibbia___Buku-Bekam-Untuk-7-Penyakit-Kronis-Thibbia-.jpg;Aqwam; Buku Sunnah
111;Buku Fiqih Pengobatan Islami Thibbia ;23;400;44400;Baru;Buku Fiqih Pengobatan Islami Thibbia .  Buku Sunnah. Thibbia;Tidak;j&tr | jner | tikir | wahana;https://alhaf.com/gambar/Thibbia___Buku-Fiqih-Pengobatan-Islami-Thibbia-.jpg;Aqwam; Buku Sunnah
112;Buku Penyakit Dan Terapi Bekamnya Thibbia ;26;500;58100;Baru;Buku Penyakit Dan Terapi Bekamnya Thibbia .  Buku Sunnah. Thibbia;Tidak;j&tr | jner | tikir | wahana;https://alhaf.com/gambar/Thibbia___Buku-Penyakit-Dan-Terapi-Bekamnya-Thibbia-.jpg;Aqwam; Buku Sunnah
113;Buku Kamus Alfiyyah -1050 Kosa-Kata Arab Yang Paling Sering Digunakan- Trimus Press ;76;85;25100;Baru;Buku Kamus Alfiyyah (1050 Kosa-Kata Arab Yang Paling Sering Digunakan) Trimus Press .  Buku Sunnah. Trimus Press;Tidak;j&tr | jner | tikir | wahana;https://alhaf.com/gambar/Trimus-Press___Buku-Kamus-Alfiyyah-(1050-Kosa-Kata-Arab-Yang-Paling-Sering-Digunakan)-Trimus-Press-.jpg;Aqwam; Buku Sunnah
114;Buku Kamus Dan Percakapan Super Lengkap Bahasa Arab Trimus Press ;34;195;32800;Baru;Buku Kamus Dan Percakapan Super Lengkap Bahasa Arab Trimus Press .  Buku Sunnah. Trimus Press;Tidak;j&tr | jner | tikir | wahana;https://alhaf.com/gambar/Trimus-Press___Buku-Kamus-Dan-Percakapan-Super-Lengkap-Bahasa-Arab-Trimus-Press-.jpg;Aqwam; Buku Sunnah
115;Buku Kamus Fiil Kata Kerja Trimus Press ;11;125;25100;Baru;Buku Kamus Fiil Kata Kerja Trimus Press .  Buku Sunnah. Trimus Press;Tidak;j&tr | jner | tikir | wahana;https://alhaf.com/gambar/Trimus-Press___Buku-Kamus-Fiil-Kata-Kerja-Trimus-Press-.jpg;Aqwam; Buku Sunnah
116;Buku Kamus Jama Taksir Trimus Press ;29;110;25100;Baru;Buku Kamus Jama Taksir Trimus Press .  Buku Sunnah. Trimus Press;Tidak;j&tr | jner | tikir | wahana;https://alhaf.com/gambar/Trimus-Press___Buku-Kamus-Jama-Taksir-Trimus-Press-.jpg;Aqwam; Buku Sunnah
117;Buku Belajar Rukun Iman Mudah Dan Ilmiah Tunas Ilmu ;11;150;29000;Baru;Buku Belajar Rukun Iman Mudah Dan Ilmiah Tunas Ilmu .  Buku Sunnah. Tunas Ilmu;Tidak;j&tr | jner | tikir | wahana;https://alhaf.com/gambar/Tunas-Ilmu___Buku-Belajar-Rukun-Iman-Mudah-Dan-Ilmiah-Tunas-Ilmu-.jpg;Aqwam; Buku Sunnah
118;Buku Happy Ending Tunas Ilmu ;20;30;11700;Baru;Buku Happy Ending Tunas Ilmu .  Buku Sunnah. Tunas Ilmu;Tidak;j&tr | jner | tikir | wahana;https://alhaf.com/gambar/Tunas-Ilmu___Buku-Happy-Ending-Tunas-Ilmu-.jpg;Aqwam; Buku Sunnah
119;Buku Motor Ibadah Tunas Ilmu ;25;75;23600;Baru;Buku Motor Ibadah Tunas Ilmu .  Buku Sunnah. Tunas Ilmu;Tidak;j&tr | jner | tikir | wahana;https://alhaf.com/gambar/Tunas-Ilmu___Buku-Motor-Ibadah-Tunas-Ilmu-.jpg;Aqwam; Buku Sunnah
120;Buku Pilih Kasih Penyakit Tunas Ilmu ;26;75;25100;Baru;Buku Pilih Kasih Penyakit Tunas Ilmu .  Buku Sunnah. Tunas Ilmu;Tidak;j&tr | jner | tikir | wahana;https://alhaf.com/gambar/Tunas-Ilmu___Buku-Pilih-Kasih-Penyakit-Tunas-Ilmu-.jpg;Aqwam; Buku Sunnah
121;Buku Tak Kenal Maka Tak Sayang Tunas Ilmu ;18;105;24400;Baru;Buku Tak Kenal Maka Tak Sayang Tunas Ilmu .  Buku Sunnah. Tunas Ilmu;Tidak;j&tr | jner | tikir | wahana;https://alhaf.com/gambar/Tunas-Ilmu___Buku-Tak-Kenal-Maka-Tak-Sayang-Tunas-Ilmu-.jpg;Aqwam; Buku Sunnah
122;Buku Panduan Lengkap Belajar Bahasa Arab Otodidak Jilid 1 -Kitab Nahwu- Turos Pustaka ;12;450;86700;Baru;Buku Panduan Lengkap Belajar Bahasa Arab Otodidak Jilid 1 (Kitab Nahwu) Turos Pustaka .  Buku Sunnah. Turos Pustaka;Tidak;j&tr | jner | tikir | wahana;https://alhaf.com/gambar/Turos-Pustaka___Buku-Panduan-Lengkap-Belajar-Bahasa-Arab-Otodidak-Jilid-1-(Kitab-Nahwu)-Turos-Pustaka-.jpg;Aqwam; Buku Sunnah
123;Buku Panduan Lengkap Belajar Bahasa Arab Otodidak Jilid 2 -Kitab Sharaf- Turos Pustaka ;15;450;86700;Baru;Buku Panduan Lengkap Belajar Bahasa Arab Otodidak Jilid 2 (Kitab Sharaf) Turos Pustaka .  Buku Sunnah. Turos Pustaka;Tidak;j&tr | jner | tikir | wahana;https://alhaf.com/gambar/Turos-Pustaka___Buku-Panduan-Lengkap-Belajar-Bahasa-Arab-Otodidak-Jilid-2-(Kitab-Sharaf)-Turos-Pustaka-.jpg;Aqwam; Buku Sunnah
124;Buku Empat Langkah Membaca Dan Menerjemah Kitab Gundul Metode Assasakiy Ukhuwatuna ;19;250;84800;Baru;Buku Empat Langkah Membaca Dan Menerjemah Kitab Gundul Metode Assasakiy Ukhuwatuna .  Buku Sunnah. Ukhwatuna ;Tidak;j&tr | jner | tikir | wahana;https://alhaf.com/gambar/Ukhwatuna-___Buku-Empat-Langkah-Membaca-Dan-Menerjemah-Kitab-Gundul-Metode-Assasakiy-Ukhuwatuna-.jpg;Aqwam; Buku Sunnah
125;Buku 38 Sahabat Yang Dijamin Masuk Surga Ummul Qura ;12;665;90600;Baru;Buku 38 Sahabat Yang Dijamin Masuk Surga Ummul Qura .  Buku Sunnah. Ummul Qura;Tidak;j&tr | jner | tikir | wahana;https://alhaf.com/gambar/Ummul-Qura___Buku-38-Sahabat-Yang-Dijamin-Masuk-Surga-Ummul-Qura-.jpg;Aqwam; Buku Sunnah
126;Buku Al Lulu Wal Marjan Mutiara Hadits Shahih Bukhari Dan Muslim Ummul Qura ;4;1620;146800;Baru;Buku Al Lulu Wal Marjan Mutiara Hadits Shahih Bukhari Dan Muslim Ummul Qura .  Buku Sunnah. Ummul Qura;Tidak;j&tr | jner | tikir | wahana;https://alhaf.com/gambar/Ummul-Qura___Buku-Al-Lulu-Wal-Marjan-Mutiara-Hadits-Shahih-Bukhari-Dan-Muslim-Ummul-Qura-.jpg;Aqwam; Buku Sunnah
127;Buku Biografi 35 Sahabiyah Nabi Ummul Qura ;14;1115;98300;Baru;Buku Biografi 35 Sahabiyah Nabi Ummul Qura .  Buku Sunnah. Ummul Qura;Tidak;j&tr | jner | tikir | wahana;https://alhaf.com/gambar/Ummul-Qura___Buku-Biografi-35-Sahabiyah-Nabi-Ummul-Qura-.jpg;Aqwam; Buku Sunnah
128;Buku Biografi 60 Sahabat Nabi Ummul Qura ;13;1035;102100;Baru;Buku Biografi 60 Sahabat Nabi Ummul Qura .  Buku Sunnah. Ummul Qura;Tidak;j&tr | jner | tikir | wahana;https://alhaf.com/gambar/Ummul-Qura___Buku-Biografi-60-Sahabat-Nabi-Ummul-Qura-.jpg;Aqwam; Buku Sunnah
129;Buku Biografi Khalifah Rasulullah Ummul Qura ;4;1250;102100;Baru;Buku Biografi Khalifah Rasulullah Ummul Qura .  Buku Sunnah. Ummul Qura;Tidak;j&tr | jner | tikir | wahana;https://alhaf.com/gambar/Ummul-Qura___Buku-Biografi-Khalifah-Rasulullah-Ummul-Qura-.jpg;Aqwam; Buku Sunnah
130;Buku Bulughul Maram Dan Penjelasannya Ummul Qura ;8;1700;147600;Baru;Buku Bulughul Maram Dan Penjelasannya Ummul Qura .  Buku Sunnah. Ummul Qura;Tidak;j&tr | jner | tikir | wahana;https://alhaf.com/gambar/Ummul-Qura___Buku-Bulughul-Maram-Dan-Penjelasannya-Ummul-Qura-.jpg;Aqwam; Buku Sunnah
131;Buku Dasar Dasar Ilmu Al Quran Ummul Qura ;12;1100;101400;Baru;Buku Dasar Dasar Ilmu Al Quran Ummul Qura .  Buku Sunnah. Ummul Qura;Tidak;j&tr | jner | tikir | wahana;https://alhaf.com/gambar/Ummul-Qura___Buku-Dasar-Dasar-Ilmu-Al-Quran-Ummul-Qura-.jpg;Aqwam; Buku Sunnah
132;Buku Ensiklopedi Shalat Kumpulan Karya Ulama Terkemuka Ummul Qura ;18;1260;113700;Baru;Buku Ensiklopedi Shalat Kumpulan Karya Ulama Terkemuka Ummul Qura .  Buku Sunnah. Ummul Qura;Tidak;j&tr | jner | tikir | wahana;https://alhaf.com/gambar/Ummul-Qura___Buku-Ensiklopedi-Shalat-Kumpulan-Karya-Ulama-Terkemuka-Ummul-Qura-.jpg;Aqwam; Buku Sunnah
133;Buku Fikih Empat Mazhab Paket 2 Jilid Ummul Qura ;2;1750;277700;Baru;Buku Fikih Empat Mazhab Paket 2 Jilid Ummul Qura .  Buku Sunnah. Ummul Qura;Tidak;j&tr | jner | tikir | wahana;https://alhaf.com/gambar/Ummul-Qura___Buku-Fikih-Empat-Mazhab-Paket-2-Jilid-Ummul-Qura-.jpg;Aqwam; Buku Sunnah
134;Buku Fikih Ibu Himpunan Hukum Islam Khas Ummahat Ummul Qura ;12;850;86700;Baru;Buku Fikih Ibu Himpunan Hukum Islam Khas Ummahat Ummul Qura .  Buku Sunnah. Ummul Qura;Tidak;j&tr | jner | tikir | wahana;https://alhaf.com/gambar/Ummul-Qura___Buku-Fikih-Ibu-Himpunan-Hukum-Islam-Khas-Ummahat-Ummul-Qura-.jpg;Aqwam; Buku Sunnah
135;Buku Halal Haram Dalam Islam Ummul Qura ;8;950;109100;Baru;Buku Halal Haram Dalam Islam Ummul Qura .  Buku Sunnah. Ummul Qura;Tidak;j&tr | jner | tikir | wahana;https://alhaf.com/gambar/Ummul-Qura___Buku-Halal-Haram-Dalam-Islam-Ummul-Qura-.jpg;As Salam Publishing; Buku Sunnah
136;Buku Himpunan Khotbah Jumat Lengkap Hc Ummul Qura ;14;1000;101400;Baru;Buku Himpunan Khotbah Jumat Lengkap Hc Ummul Qura .  Buku Sunnah. Ummul Qura;Tidak;j&tr | jner | tikir | wahana;https://alhaf.com/gambar/Ummul-Qura___Buku-Himpunan-Khotbah-Jumat-Lengkap-Hc-Ummul-Qura-.jpg;As Salam Publishing; Buku Sunnah
137;Buku Kisah Kisah Dalam Al Quran Ummul Qura ;9;1500;139900;Baru;Buku Kisah Kisah Dalam Al Quran Ummul Qura .  Buku Sunnah. Ummul Qura;Tidak;j&tr | jner | tikir | wahana;https://alhaf.com/gambar/Ummul-Qura___Buku-Kisah-Kisah-Dalam-Al-Quran-Ummul-Qura-.jpg;As Salam Publishing; Buku Sunnah
138;Buku Kisah Kisah Nubuat Dari Nabi Ummul Qura ;1;1000;102100;Baru;Buku Kisah Kisah Nubuat Dari Nabi Ummul Qura .  Buku Sunnah. Ummul Qura;Tidak;j&tr | jner | tikir | wahana;https://alhaf.com/gambar/Ummul-Qura___Buku-Kisah-Kisah-Nubuat-Dari-Nabi-Ummul-Qura-.jpg;As Salam Publishing; Buku Sunnah
139;Buku Kisah Para Nabi Ummul Qura ;8;1300;152200;Baru;Buku Kisah Para Nabi Ummul Qura .  Buku Sunnah. Ummul Qura;Tidak;j&tr | jner | tikir | wahana;https://alhaf.com/gambar/Ummul-Qura___Buku-Kisah-Para-Nabi-Ummul-Qura-.jpg;As Salam Publishing; Buku Sunnah
140;Buku Kisah Para Tabiin Ummul Qura ;14;1200;144500;Baru;Buku Kisah Para Tabiin Ummul Qura .  Buku Sunnah. Ummul Qura;Tidak;j&tr | jner | tikir | wahana;https://alhaf.com/gambar/Ummul-Qura___Buku-Kisah-Para-Tabiin-Ummul-Qura-.jpg;As Salam Publishing; Buku Sunnah
141;Buku Kitab Tauhid Ummul Qura ;2;800;77500;Baru;Buku Kitab Tauhid Ummul Qura .  Buku Sunnah. Ummul Qura;Tidak;j&tr | jner | tikir | wahana;https://alhaf.com/gambar/Ummul-Qura___Buku-Kitab-Tauhid-Ummul-Qura-.jpg;As Salam Publishing; Buku Sunnah
142;Buku Konsep Kepemimpinan Dalam Islam Ummul Qura ;5;1150;113700;Baru;Buku Konsep Kepemimpinan Dalam Islam Ummul Qura .  Buku Sunnah. Ummul Qura;Tidak;j&tr | jner | tikir | wahana;https://alhaf.com/gambar/Ummul-Qura___Buku-Konsep-Kepemimpinan-Dalam-Islam-Ummul-Qura-.jpg;As Salam Publishing; Buku Sunnah
143;Buku Mencapai Shalat Khusyuk Ummul Qura ;8;800;98300;Baru;Buku Mencapai Shalat Khusyuk Ummul Qura .  Buku Sunnah. Ummul Qura;Tidak;j&tr | jner | tikir | wahana;https://alhaf.com/gambar/Ummul-Qura___Buku-Mencapai-Shalat-Khusyuk-Ummul-Qura-.jpg;As Salam Publishing; Buku Sunnah
144;Buku Mengenal Pribadi Agung Muhammad Ummul Qura ;21;500;68300;Baru;Buku Mengenal Pribadi Agung Muhammad Ummul Qura .  Buku Sunnah. Ummul Qura;Tidak;j&tr | jner | tikir | wahana;https://alhaf.com/gambar/Ummul-Qura___Buku-Mengenal-Pribadi-Agung-Muhammad-Ummul-Qura-.jpg;As Salam Publishing; Buku Sunnah
145;Buku Menyambut Buah Hati Ummul Qura ;14;800;90600;Baru;Buku Menyambut Buah Hati Ummul Qura .  Buku Sunnah. Ummul Qura;Tidak;j&tr | jner | tikir | wahana;https://alhaf.com/gambar/Ummul-Qura___Buku-Menyambut-Buah-Hati-Ummul-Qura-.jpg;As Salam Publishing; Buku Sunnah
146;Buku Minhajul Muslim Pedoman Hidup Harian Seorang Muslim Ummul Qura ;6;1750;125200;Baru;Buku Minhajul Muslim Pedoman Hidup Harian Seorang Muslim Ummul Qura .  Buku Sunnah. Ummul Qura;Tidak;j&tr | jner | tikir | wahana;https://alhaf.com/gambar/Ummul-Qura___Buku-Minhajul-Muslim-Pedoman-Hidup-Harian-Seorang-Muslim-Ummul-Qura-.jpg;As Salam Publishing; Buku Sunnah
147;Buku Nurul Yaqin Ummul Qura ;10;1025;86700;Baru;Buku Nurul Yaqin Ummul Qura .  Buku Sunnah. Ummul Qura;Tidak;j&tr | jner | tikir | wahana;https://alhaf.com/gambar/Ummul-Qura___Buku-Nurul-Yaqin-Ummul-Qura-.jpg;As Salam Publishing; Buku Sunnah
148;Buku Para Panglima Islam Penakluk Dunia Ummul Qura ;4;1150;106000;Baru;Buku Para Panglima Islam Penakluk Dunia Ummul Qura .  Buku Sunnah. Ummul Qura;Tidak;j&tr | jner | tikir | wahana;https://alhaf.com/gambar/Ummul-Qura___Buku-Para-Panglima-Islam-Penakluk-Dunia-Ummul-Qura-.jpg;As Salam Publishing; Buku Sunnah
149;Buku Peperangan Rasulullah Shallallahu Alaihi Wa Sallam Ummul Qura ;18;1350;122200;Baru;Buku Peperangan Rasulullah Shallallahu Alaihi Wa Sallam Ummul Qura .  Buku Sunnah. Ummul Qura;Tidak;j&tr | jner | tikir | wahana;https://alhaf.com/gambar/Ummul-Qura___Buku-Peperangan-Rasulullah-Shallallahu-Alaihi-Wa-Sallam-Ummul-Qura-.jpg;As Salam Publishing; Buku Sunnah
150;Buku Riyadhus Shalihin Dan Penjelasannya Hc Ummul Qura ;1;2000;154500;Baru;Buku Riyadhus Shalihin Dan Penjelasannya Hc Ummul Qura .  Buku Sunnah. Ummul Qura;Tidak;j&tr | jner | tikir | wahana;https://alhaf.com/gambar/Ummul-Qura___Buku-Riyadhus-Shalihin-Dan-Penjelasannya-Hc-Ummul-Qura-.jpg;As Salam Publishing; Buku Sunnah
151;Buku Ruqyah Jin Sihir Dan Terapinya Ummul Qura ;17;1185;124500;Baru;Buku Ruqyah Jin Sihir Dan Terapinya Ummul Qura .  Buku Sunnah. Ummul Qura;Tidak;j&tr | jner | tikir | wahana;https://alhaf.com/gambar/Ummul-Qura___Buku-Ruqyah-Jin-Sihir-Dan-Terapinya-Ummul-Qura-.jpg;As Salam Publishing; Buku Sunnah
152;Buku Sejarah Daulah Umawiyah Dan Abbasiyah Ummul Qura ;7;1000;90600;Baru;Buku Sejarah Daulah Umawiyah Dan Abbasiyah Ummul Qura .  Buku Sunnah. Ummul Qura;Tidak;j&tr | jner | tikir | wahana;https://alhaf.com/gambar/Ummul-Qura___Buku-Sejarah-Daulah-Umawiyah-Dan-Abbasiyah-Ummul-Qura-.jpg;As Salam Publishing; Buku Sunnah
153;Buku Sejarah Daulah Utsmaniyah Ummul Qurra ;3;1570;144500;Baru;Buku Sejarah Daulah Utsmaniyah Ummul Qurra .  Buku Sunnah. Ummul Qura;Tidak;j&tr | jner | tikir | wahana;https://alhaf.com/gambar/Ummul-Qura___Buku-Sejarah-Daulah-Utsmaniyah-Ummul-Qurra-.jpg;As Salam Publishing; Buku Sunnah
154;Buku Sejarah Legislasi Hukum Islam Ummul Qura ;4;1080;113700;Baru;Buku Sejarah Legislasi Hukum Islam Ummul Qura .  Buku Sunnah. Ummul Qura;Tidak;j&tr | jner | tikir | wahana;https://alhaf.com/gambar/Ummul-Qura___Buku-Sejarah-Legislasi-Hukum-Islam-Ummul-Qura-.jpg;As Salam Publishing; Buku Sunnah
155;Buku Sifat Shalat Nabi Ummul Qura ;17;1000;67500;Baru;Buku Sifat Shalat Nabi Ummul Qura .  Buku Sunnah. Ummul Qura;Tidak;j&tr | jner | tikir | wahana;https://alhaf.com/gambar/Ummul-Qura___Buku-Sifat-Shalat-Nabi-Ummul-Qura-.jpg;As Salam Publishing; Buku Sunnah
156;Buku Sirah Nabawiyyah Ummul Qura ;11;1500;139100;Baru;Buku Sirah Nabawiyyah Ummul Qura .  Buku Sunnah. Ummul Qura;Tidak;j&tr | jner | tikir | wahana;https://alhaf.com/gambar/Ummul-Qura___Buku-Sirah-Nabawiyyah-Ummul-Qura-.jpg;As Salam Publishing; Buku Sunnah
157;Buku Syamail Muhammad Ummul Qura ;10;650;98300;Baru;Buku Syamail Muhammad Ummul Qura .  Buku Sunnah. Ummul Qura;Tidak;j&tr | jner | tikir | wahana;https://alhaf.com/gambar/Ummul-Qura___Buku-Syamail-Muhammad-Ummul-Qura-.jpg;As Salam Publishing; Buku Sunnah
158;Buku Tazkiyatun Nafs Penyucian Jiwa Dalam Islam Ummul Qura ;9;650;86700;Baru;Buku Tazkiyatun Nafs Penyucian Jiwa Dalam Islam Ummul Qura .  Buku Sunnah. Ummul Qura;Tidak;j&tr | jner | tikir | wahana;https://alhaf.com/gambar/Ummul-Qura___Buku-Tazkiyatun-Nafs-Penyucian-Jiwa-Dalam-Islam-Ummul-Qura-.jpg;As Salam Publishing; Buku Sunnah
159;Buku Bidadari 2 Negeri Wacana Ilmiah Press ;11;620;79000;Baru;Buku Bidadari 2 Negeri Wacana Ilmiah Press .  Buku Sunnah. Wacana Ilmiah Press ;Tidak;j&tr | jner | tikir | wahana;https://alhaf.com/gambar/Wacana-Ilmiah-Press-___Buku-Bidadari-2-Negeri-Wacana-Ilmiah-Press-.jpg;As Salam Publishing; Buku Sunnah
160;Buku Gerakan Hutsi Gurita Syiah Rafidhah Di Selatan Jazirah Arab Wacana Ilmiah Press ;9;500;36700;Baru;Buku Gerakan Hutsi Gurita Syiah Rafidhah Di Selatan Jazirah Arab Wacana Ilmiah Press .  Buku Sunnah. Wacana Ilmiah Press ;Tidak;j&tr | jner | tikir | wahana;https://alhaf.com/gambar/Wacana-Ilmiah-Press-___Buku-Gerakan-Hutsi-Gurita-Syiah-Rafidhah-Di-Selatan-Jazirah-Arab-Wacana-Ilmiah-Press-.jpg;As Salam Publishing; Buku Sunnah
161;Buku Malu Kunci Surgamu Wacana Ilmiah Press ;12;250;21300;Baru;Buku Malu Kunci Surgamu Wacana Ilmiah Press .  Buku Sunnah. Wacana Ilmiah Press ;Tidak;j&tr | jner | tikir | wahana;https://alhaf.com/gambar/Wacana-Ilmiah-Press-___Buku-Malu-Kunci-Surgamu-Wacana-Ilmiah-Press-.jpg;As Salam Publishing; Buku Sunnah
162;Buku Sudah Munculkah Dajjal Yajuj Dan Majuj Wacana Ilmiah Press ;12;200;29000;Baru;Buku Sudah Munculkah Dajjal Yajuj Dan Majuj Wacana Ilmiah Press .  Buku Sunnah. Wacana Ilmiah Press ;Tidak;j&tr | jner | tikir | wahana;https://alhaf.com/gambar/Wacana-Ilmiah-Press-___Buku-Sudah-Munculkah-Dajjal-Yajuj-Dan-Majuj-Wacana-Ilmiah-Press-.jpg;As Salam Publishing; Buku Sunnah
163;Buku Tarekat Tasawuf Tahlilan Dan Maulidan Wacana Ilmiah Press ;14;300;36700;Baru;Buku Tarekat Tasawuf Tahlilan Dan Maulidan Wacana Ilmiah Press .  Buku Sunnah. Wacana Ilmiah Press ;Tidak;j&tr | jner | tikir | wahana;https://alhaf.com/gambar/Wacana-Ilmiah-Press-___Buku-Tarekat-Tasawuf-Tahlilan-Dan-Maulidan-Wacana-Ilmiah-Press-.jpg;As Salam Publishing; Buku Sunnah
164;Buku Kamus Al Mufradat Wafa Press ;16;200;26800;Baru;Buku Kamus Al Mufradat Wafa Press .  Buku Sunnah. Wafa Press;Tidak;j&tr | jner | tikir | wahana;https://alhaf.com/gambar/Wafa-Press___Buku-Kamus-Al-Mufradat-Wafa-Press-.jpg;As Salam Publishing; Buku Sunnah
165;Buku 10 Pembatal Keislaman Warasatul Anbiya ;2;100;25100;Baru;Buku 10 Pembatal Keislaman Warasatul Anbiya .  Buku Sunnah. Warasatul Anbiya;Tidak;j&tr | jner | tikir | wahana;https://alhaf.com/gambar/Warasatul-Anbiya___Buku-10-Pembatal-Keislaman-Warasatul-Anbiya-.jpg;As Salam Publishing; Buku Sunnah
166;Buku Nestapa Anak Durhaka Yassir ;19;800;52100;Baru;Buku Nestapa Anak Durhaka Yassir .  Buku Sunnah. Yassir;Tidak;j&tr | jner | tikir | wahana;https://alhaf.com/gambar/Yassir___Buku-Nestapa-Anak-Durhaka-Yassir-.jpg;As Salam Publishing; Buku Sunnah
167;Buku Nikmatilah Hidup Anda Yassir ;5;800;113700;Baru;Buku Nikmatilah Hidup Anda Yassir .  Buku Sunnah. Yassir;Tidak;j&tr | jner | tikir | wahana;https://alhaf.com/gambar/Yassir___Buku-Nikmatilah-Hidup-Anda-Yassir-.jpg;As Salam Publishing; Buku Sunnah
168;Buku Rumahku Surgaku Yassir ;17;200;29000;Baru;Buku Rumahku Surgaku Yassir .  Buku Sunnah. Yassir;Tidak;j&tr | jner | tikir | wahana;https://alhaf.com/gambar/Yassir___Buku-Rumahku-Surgaku-Yassir-.jpg;As Salam Publishing; Buku Sunnah
169;Buku 100 Sunnah Nabi Yang Sering Diremehkan Zam Zam ;16;500;43600;Baru;Buku 100 Sunnah Nabi Yang Sering Diremehkan Zam Zam .  Buku Sunnah. Zam Zam;Tidak;j&tr | jner | tikir | wahana;https://alhaf.com/gambar/Zam-Zam___Buku-100-Sunnah-Nabi-Yang-Sering-Diremehkan-Zam-Zam-.jpg;As Salam Publishing; Buku Sunnah
170;Buku 30 Inspirasi Keluarga Harmonis Zam Zam ;15;400;22500;Baru;Buku 30 Inspirasi Keluarga Harmonis Zam Zam .  Buku Sunnah. Zam Zam;Tidak;j&tr | jner | tikir | wahana;https://alhaf.com/gambar/Zam-Zam___Buku-30-Inspirasi-Keluarga-Harmonis-Zam-Zam-.jpg;As Salam Publishing; Buku Sunnah
171;Buku 400 Kisah Kisah Hidup Imam Empat Madzhab Zam Zam ;7;400;50600;Baru;Buku 400 Kisah Kisah Hidup Imam Empat Madzhab Zam Zam .  Buku Sunnah. Zam Zam;Tidak;j&tr | jner | tikir | wahana;https://alhaf.com/gambar/Zam-Zam___Buku-400-Kisah-Kisah-Hidup-Imam-Empat-Madzhab-Zam-Zam-.jpg;As Salam Publishing; Buku Sunnah
172;Buku Agar Rumahmu Tak Seperti Kuburan Zam Zam ;28;110;19000;Baru;Buku Agar Rumahmu Tak Seperti Kuburan Zam Zam .  Buku Sunnah. Zam Zam;Tidak;j&tr | jner | tikir | wahana;https://alhaf.com/gambar/Zam-Zam___Buku-Agar-Rumahmu-Tak-Seperti-Kuburan-Zam-Zam-.jpg;As Salam Publishing; Buku Sunnah
173;Buku Al Bayan Kamus Kosa Kata Al Quran Zam Zam ;5;400;52100;Baru;Buku Al Bayan Kamus Kosa Kata Al Quran Zam Zam .  Buku Sunnah. Zam Zam;Tidak;j&tr | jner | tikir | wahana;https://alhaf.com/gambar/Zam-Zam___Buku-Al-Bayan-Kamus-Kosa-Kata-Al-Quran-Zam-Zam-.jpg;As Salam Publishing; Buku Sunnah
