1;Buku Temui Aku Di Telaga Pustaka Darul Ihsan Imam Syafii ;8;100;18200;Baru;Buku Temui Aku Di Telaga Pustaka Darul Ihsan Imam Syafii .  Buku Sunnah. Pustaka Imam Syafii;Tidak;j&tr | jner | tikir | wahana;https://alhaf.com/gambar/Pustaka-Imam-Syafii___Buku-Temui-Aku-Di-Telaga-Pustaka-Darul-Ihsan-Imam-Syafii-.jpg;Adz Dzahabi; Buku Sunnah
2;Buku Umrah Praktis Dan Ziarah Pustaka Imam Syafii ;18;150;21300;Baru;Buku Umrah Praktis Dan Ziarah Pustaka Imam Syafii .  Buku Sunnah. Pustaka Imam Syafii;Tidak;j&tr | jner | tikir | wahana;https://alhaf.com/gambar/Pustaka-Imam-Syafii___Buku-Umrah-Praktis-Dan-Ziarah-Pustaka-Imam-Syafii-.jpg;Adz Dzahabi; Buku Sunnah
3;Buku Untukmu Yang Berjiwa Hanif Pustaka Imam Syafii ;6;500;25100;Baru;Buku Untukmu Yang Berjiwa Hanif Pustaka Imam Syafii .  Buku Sunnah. Pustaka Imam Syafii;Tidak;j&tr | jner | tikir | wahana;https://alhaf.com/gambar/Pustaka-Imam-Syafii___Buku-Untukmu-Yang-Berjiwa-Hanif-Pustaka-Imam-Syafii-.jpg;Adz Dzahabi; Buku Sunnah
4;Buku Vonis Kafir Dalam Timbangan Islam Pustaka Imam Syafii ;11;100;14400;Baru;Buku Vonis Kafir Dalam Timbangan Islam Pustaka Imam Syafii .  Buku Sunnah. Pustaka Imam Syafii;Tidak;j&tr | jner | tikir | wahana;https://alhaf.com/gambar/Pustaka-Imam-Syafii___Buku-Vonis-Kafir-Dalam-Timbangan-Islam-Pustaka-Imam-Syafii-.jpg;Adz Dzahabi; Buku Sunnah
5;Buku Wali Allah Ataukah Wali Syaitan Pustaka Imam Syafii ;9;850;63600;Baru;Buku Wali Allah Ataukah Wali Syaitan Pustaka Imam Syafii .  Buku Sunnah. Pustaka Imam Syafii;Tidak;j&tr | jner | tikir | wahana;https://alhaf.com/gambar/Pustaka-Imam-Syafii___Buku-Wali-Allah-Ataukah-Wali-Syaitan-Pustaka-Imam-Syafii-.jpg;Adz Dzahabi; Buku Sunnah
6;Buku Ayah Ditemani Sunyi Aku Merindukanmu Pustaka Muslim ;3;400;44400;Baru;Buku Ayah Ditemani Sunyi Aku Merindukanmu Pustaka Muslim .  Buku Sunnah. Pustaka Muslim;Tidak;j&tr | jner | tikir | wahana;https://alhaf.com/gambar/Pustaka-Muslim___Buku-Ayah-Ditemani-Sunyi-Aku-Merindukanmu-Pustaka-Muslim-.jpg;Adz Dzahabi; Buku Sunnah
7;Buku Saku Ikhlas Ringan Diucapkan Berat Dipertahankan Pustaka Muslim ;4;40;9700;Baru;Buku Saku Ikhlas Ringan Diucapkan Berat Dipertahankan Pustaka Muslim .  Buku Sunnah. Pustaka Muslim;Tidak;j&tr | jner | tikir | wahana;https://alhaf.com/gambar/Pustaka-Muslim___Buku-Saku-Ikhlas-Ringan-Diucapkan-Berat-Dipertahankan-Pustaka-Muslim-.jpg;Adz Dzahabi; Buku Sunnah
8;Buku Saku Natal Hari Raya Siapa Pustaka Muslim ;13;30;9700;Baru;Buku Saku Natal Hari Raya Siapa Pustaka Muslim .  Buku Sunnah. Pustaka Muslim;Tidak;j&tr | jner | tikir | wahana;https://alhaf.com/gambar/Pustaka-Muslim___Buku-Saku-Natal-Hari-Raya-Siapa-Pustaka-Muslim-.jpg;Adz Dzahabi; Buku Sunnah
9;Buku Saku Nikah Yuk Pustaka Muslim ;29;30;8200;Baru;Buku Saku Nikah Yuk Pustaka Muslim .  Buku Sunnah. Pustaka Muslim;Tidak;j&tr | jner | tikir | wahana;https://alhaf.com/gambar/Pustaka-Muslim___Buku-Saku-Nikah-Yuk-Pustaka-Muslim-.jpg;Adz Dzahabi; Buku Sunnah
10;Buku Saku Temani Aku Bunda Pustaka Muslim ;11;30;8200;Baru;Buku Saku Temani Aku Bunda Pustaka Muslim .  Buku Sunnah. Pustaka Muslim;Tidak;j&tr | jner | tikir | wahana;https://alhaf.com/gambar/Pustaka-Muslim___Buku-Saku-Temani-Aku-Bunda-Pustaka-Muslim-.jpg;Ahsan Media; Buku Sunnah
11;Buku Saku Travelling Bernilai Ibadah Pustaka Muslim ;13;100;9700;Baru;Buku Saku Travelling Bernilai Ibadah Pustaka Muslim .  Buku Sunnah. Pustaka Muslim;Tidak;j&tr | jner | tikir | wahana;https://alhaf.com/gambar/Pustaka-Muslim___Buku-Saku-Travelling-Bernilai-Ibadah-Pustaka-Muslim-.jpg;Aisar; Buku Sunnah
12;Buku Edisi Revisi Mengikuti Ajaran Nabi Bukanlah Teroris Pustaka Muslim ;19;280;17400;Baru;Buku Edisi Revisi Mengikuti Ajaran Nabi Bukanlah Teroris Pustaka Muslim .  Buku Sunnah. Pustaka Muslim;Tidak;j&tr | jner | tikir | wahana;https://alhaf.com/gambar/Pustaka-Muslim___Buku-Edisi-Revisi-Mengikuti-Ajaran-Nabi-Bukanlah-Teroris-Pustaka-Muslim-.jpg;Aisar; Buku Sunnah
13;Buku Fikih Shalat Dhuha Pustaka Muslim ;10;150;17400;Baru;Buku Fikih Shalat Dhuha Pustaka Muslim .  Buku Sunnah. Pustaka Muslim;Tidak;j&tr | jner | tikir | wahana;https://alhaf.com/gambar/Pustaka-Muslim___Buku-Fikih-Shalat-Dhuha-Pustaka-Muslim-.jpg;Aisar; Buku Sunnah
14;Buku Imunisasi Lumpuhkan Generasi Pustaka Muslim ;8;800;63600;Baru;Buku Imunisasi Lumpuhkan Generasi Pustaka Muslim .  Buku Sunnah. Pustaka Muslim;Tidak;j&tr | jner | tikir | wahana;https://alhaf.com/gambar/Pustaka-Muslim___Buku-Imunisasi-Lumpuhkan-Generasi-Pustaka-Muslim-.jpg;Aisar; Buku Sunnah
15;Buku Inilah Jalanku Jalan Rasulullah Dan Para Shahabat Dalam Beragama Pustaka Muslim ;9;100;13600;Baru;Buku Inilah Jalanku Jalan Rasulullah Dan Para Shahabat Dalam Beragama Pustaka Muslim .  Buku Sunnah. Pustaka Muslim;Tidak;j&tr | jner | tikir | wahana;https://alhaf.com/gambar/Pustaka-Muslim___Buku-Inilah-Jalanku-Jalan-Rasulullah-Dan-Para-Shahabat-Dalam-Beragama-Pustaka-Muslim-.jpg;Aisar; Buku Sunnah
16;Buku Islam Sains Dan Kesehatan Pustaka Muslim ;9;1000;98300;Baru;Buku Islam Sains Dan Kesehatan Pustaka Muslim .  Buku Sunnah. Pustaka Muslim;Tidak;j&tr | jner | tikir | wahana;https://alhaf.com/gambar/Pustaka-Muslim___Buku-Islam-Sains-Dan-Kesehatan-Pustaka-Muslim-.jpg;Aisar; Buku Sunnah
17;Buku Jawaban 3 Pertanyaan Kubur Pustaka Muslim ;4;500;40500;Baru;Buku Jawaban 3 Pertanyaan Kubur Pustaka Muslim .  Buku Sunnah. Pustaka Muslim;Tidak;j&tr | jner | tikir | wahana;https://alhaf.com/gambar/Pustaka-Muslim___Buku-Jawaban-3-Pertanyaan-Kubur-Pustaka-Muslim-.jpg;Aisar; Buku Sunnah
18;Buku Kenapa Masih Enggan Shalat Pustaka Muslim ;1;100;17400;Baru;Buku Kenapa Masih Enggan Shalat Pustaka Muslim .  Buku Sunnah. Pustaka Muslim;Tidak;j&tr | jner | tikir | wahana;https://alhaf.com/gambar/Pustaka-Muslim___Buku-Kenapa-Masih-Enggan-Shalat-Pustaka-Muslim-.jpg;Akbar Media; Buku Sunnah
19;Buku Kesetiaan Pada Non Muslim Pustaka Muslim ;9;90;9700;Baru;Buku Kesetiaan Pada Non Muslim Pustaka Muslim .  Buku Sunnah. Pustaka Muslim;Tidak;j&tr | jner | tikir | wahana;https://alhaf.com/gambar/Pustaka-Muslim___Buku-Kesetiaan-Pada-Non-Muslim-Pustaka-Muslim-.jpg;Al Hidayah; Buku Sunnah
20;Buku Mengenal Bid Ah Lebih Dekat Pustaka Muslim ;7;200;13600;Baru;Buku Mengenal Bid Ah Lebih Dekat Pustaka Muslim .  Buku Sunnah. Pustaka Muslim;Tidak;j&tr | jner | tikir | wahana;https://alhaf.com/gambar/Pustaka-Muslim___Buku-Mengenal-Bid-Ah-Lebih-Dekat-Pustaka-Muslim-.jpg;Al Hidayah; Buku Sunnah
21;Buku Mengikuti Ajaran Nabi Bukanlah Teroris Pustaka Muslim ;7;400;17400;Baru;Buku Mengikuti Ajaran Nabi Bukanlah Teroris Pustaka Muslim .  Buku Sunnah. Pustaka Muslim;Tidak;j&tr | jner | tikir | wahana;https://alhaf.com/gambar/Pustaka-Muslim___Buku-Mengikuti-Ajaran-Nabi-Bukanlah-Teroris-Pustaka-Muslim-.jpg;Al Hidayah; Buku Sunnah
22;Buku Mutiara Nasihat Ramadhan Pustaka Muslim Seri 1 ;85;160;21300;Baru;Buku Mutiara Nasihat Ramadhan Pustaka Muslim Seri 1 .  Buku Sunnah. Pustaka Muslim;Tidak;j&tr | jner | tikir | wahana;https://alhaf.com/gambar/Pustaka-Muslim___Buku-Mutiara-Nasihat-Ramadhan-Pustaka-Muslim-Seri-1-.jpg;Al Qowam; Buku Sunnah
23;Buku Mutiara Nasihat Ramadhan Pustaka Muslim Seri 2 ;128;230;25100;Baru;Buku Mutiara Nasihat Ramadhan Pustaka Muslim Seri 2 .  Buku Sunnah. Pustaka Muslim;Tidak;j&tr | jner | tikir | wahana;https://alhaf.com/gambar/Pustaka-Muslim___Buku-Mutiara-Nasihat-Ramadhan-Pustaka-Muslim-Seri-2-.jpg;Al Qowam; Buku Sunnah
24;Buku Panduan Amal Shalih Di Musim Hujan Pustaka Muslim ;10;100;11300;Baru;Buku Panduan Amal Shalih Di Musim Hujan Pustaka Muslim .  Buku Sunnah. Pustaka Muslim;Tidak;j&tr | jner | tikir | wahana;https://alhaf.com/gambar/Pustaka-Muslim___Buku-Panduan-Amal-Shalih-Di-Musim-Hujan-Pustaka-Muslim-.jpg;Al Qowam; Buku Sunnah
25;Buku Panduan Fikih Qurban & Aqiqah Pustaka Muslim ;65;400;21300;Baru;Buku Panduan Fikih Qurban & Aqiqah Pustaka Muslim .  Buku Sunnah. Pustaka Muslim;Tidak;j&tr | jner | tikir | wahana;https://alhaf.com/gambar/Pustaka-Muslim___Buku-Panduan-Fikih-Qurban-&-Aqiqah-Pustaka-Muslim-.jpg;Al Qowam; Buku Sunnah
26;Buku Panduan Mudah Tentang Zakat Pustaka Muslim ;10;200;25100;Baru;Buku Panduan Mudah Tentang Zakat Pustaka Muslim .  Buku Sunnah. Pustaka Muslim;Tidak;j&tr | jner | tikir | wahana;https://alhaf.com/gambar/Pustaka-Muslim___Buku-Panduan-Mudah-Tentang-Zakat-Pustaka-Muslim-.jpg;Al Qowam; Buku Sunnah
27;Buku Panduan Qurban Pustaka Muslim ;16;400;21300;Baru;Buku Panduan Qurban Pustaka Muslim .  Buku Sunnah. Pustaka Muslim;Tidak;j&tr | jner | tikir | wahana;https://alhaf.com/gambar/Pustaka-Muslim___Buku-Panduan-Qurban-Pustaka-Muslim-.jpg;Al Qowam; Buku Sunnah
28;Buku Pembuka Pintu Rezeki Pustaka Muslim ;11;150;21300;Baru;Buku Pembuka Pintu Rezeki Pustaka Muslim .  Buku Sunnah. Pustaka Muslim;Tidak;j&tr | jner | tikir | wahana;https://alhaf.com/gambar/Pustaka-Muslim___Buku-Pembuka-Pintu-Rezeki-Pustaka-Muslim-.jpg;Al Qowam; Buku Sunnah
29;Buku Pesugihan Biar Kaya Mendadak Pustaka Muslim ;11;200;21300;Baru;Buku Pesugihan Biar Kaya Mendadak Pustaka Muslim .  Buku Sunnah. Pustaka Muslim;Tidak;j&tr | jner | tikir | wahana;https://alhaf.com/gambar/Pustaka-Muslim___Buku-Pesugihan-Biar-Kaya-Mendadak-Pustaka-Muslim-.jpg;Al Qowam; Buku Sunnah
30;Buku Tauhid Kunci Kebahagiaan Yang Terlupakan Pustaka Muslim ;16;200;13600;Baru;Buku Tauhid Kunci Kebahagiaan Yang Terlupakan Pustaka Muslim .  Buku Sunnah. Pustaka Muslim;Tidak;j&tr | jner | tikir | wahana;https://alhaf.com/gambar/Pustaka-Muslim___Buku-Tauhid-Kunci-Kebahagiaan-Yang-Terlupakan-Pustaka-Muslim-.jpg;Al Qowam; Buku Sunnah
31;Buku Ummi Ijinkan Aku Menangis Pustaka Muslim ;5;430;36700;Baru;Buku Ummi Ijinkan Aku Menangis Pustaka Muslim .  Buku Sunnah. Pustaka Muslim;Tidak;j&tr | jner | tikir | wahana;https://alhaf.com/gambar/Pustaka-Muslim___Buku-Ummi-Ijinkan-Aku-Menangis-Pustaka-Muslim-.jpg;Al Qowam; Buku Sunnah
32;Buku Vaksinasi Mubah Dan Bermanfaat Pustaka Muslim ;28;300;25100;Baru;Buku Vaksinasi Mubah Dan Bermanfaat Pustaka Muslim .  Buku Sunnah. Pustaka Muslim;Tidak;j&tr | jner | tikir | wahana;https://alhaf.com/gambar/Pustaka-Muslim___Buku-Vaksinasi-Mubah-Dan-Bermanfaat-Pustaka-Muslim-.jpg;Al Qowam; Buku Sunnah
33;Buku La Taskut Panduan Praktis Percakapan Bahasa Arab ;33;280;25100;Baru;Buku La Taskut Panduan Praktis Percakapan Bahasa Arab .  Buku Sunnah. Pustaka Nun;Tidak;j&tr | jner | tikir | wahana;https://alhaf.com/gambar/Pustaka-Nun___Buku-La-Taskut-Panduan-Praktis-Percakapan-Bahasa-Arab-.jpg;Al Qowam; Buku Sunnah
34;Buku Bahasa Amiyah Takallam Saudi Pustaka Progressif ;16;700;39000;Baru;Buku Bahasa Amiyah Takallam Saudi Pustaka Progressif .  Buku Sunnah. Pustaka Progressif ;Tidak;j&tr | jner | tikir | wahana;https://alhaf.com/gambar/Pustaka-Progressif-___Buku-Bahasa-Amiyah-Takallam-Saudi-Pustaka-Progressif-.jpg;Al Qowam; Buku Sunnah
35;Buku Kamus Al Munawwir Arab Indonesia Pustaka Progressif ;50;2100;152600;Baru;Buku Kamus Al Munawwir Arab Indonesia Pustaka Progressif .  Buku Sunnah. Pustaka Progressif ;Tidak;j&tr | jner | tikir | wahana;https://alhaf.com/gambar/Pustaka-Progressif-___Buku-Kamus-Al-Munawwir-Arab-Indonesia-Pustaka-Progressif-.jpg;Al Qowam; Buku Sunnah
36;Buku Kamus Al Munawwir Indonesia Arab Pustaka Progressif ;4;1400;104900;Baru;Buku Kamus Al Munawwir Indonesia Arab Pustaka Progressif .  Buku Sunnah. Pustaka Progressif ;Tidak;j&tr | jner | tikir | wahana;https://alhaf.com/gambar/Pustaka-Progressif-___Buku-Kamus-Al-Munawwir-Indonesia-Arab-Pustaka-Progressif-.jpg;Al Qowam; Buku Sunnah
37;Buku Kamus Litullab Arab Indo Pustaka Progresif ;9;870;75900;Baru;Buku Kamus Litullab Arab Indo Pustaka Progresif .  Buku Sunnah. Pustaka Progressif ;Tidak;j&tr | jner | tikir | wahana;https://alhaf.com/gambar/Pustaka-Progressif-___Buku-Kamus-Litullab-Arab-Indo-Pustaka-Progresif-.jpg;Al Qowam; Buku Sunnah
38;Buku Biografi Istri Istri Para Nabi Qiblatuna ;22;400;39800;Baru;Buku Biografi Istri Istri Para Nabi Qiblatuna .  Buku Sunnah. Qiblatuna;Tidak;j&tr | jner | tikir | wahana;https://alhaf.com/gambar/Qiblatuna___Buku-Biografi-Istri-Istri-Para-Nabi-Qiblatuna-.jpg;Al Qowam; Buku Sunnah
39;Buku Jangan Biarkan Puasa Anda Sia Sia Qiblatuna ;62;150;21300;Baru;Buku Jangan Biarkan Puasa Anda Sia Sia Qiblatuna .  Buku Sunnah. Qiblatuna;Tidak;j&tr | jner | tikir | wahana;https://alhaf.com/gambar/Qiblatuna___Buku-Jangan-Biarkan-Puasa-Anda-Sia-Sia-Qiblatuna-.jpg;Al Qowam; Buku Sunnah
40;Buku Biografi Rasulullah Qisthy Press ;10;1500;167600;Baru;Buku Biografi Rasulullah Qisthy Press .  Buku Sunnah. Qisthy Press;Tidak;j&tr | jner | tikir | wahana;https://alhaf.com/gambar/Qisthy-Press___Buku-Biografi-Rasulullah-Qisthy-Press-.jpg;Al Qowam; Buku Sunnah
41;Buku Fikih Akhlak Qisthy Press ;10;800;82900;Baru;Buku Fikih Akhlak Qisthy Press .  Buku Sunnah. Qisthy Press;Tidak;j&tr | jner | tikir | wahana;https://alhaf.com/gambar/Qisthy-Press___Buku-Fikih-Akhlak-Qisthy-Press-.jpg;Al Qowam; Buku Sunnah
42;Buku Hakekat Ruh Qisthy Press ;6;605;67500;Baru;Buku Hakekat Ruh Qisthy Press .  Buku Sunnah. Qisthy Press;Tidak;j&tr | jner | tikir | wahana;https://alhaf.com/gambar/Qisthy-Press___Buku-Hakekat-Ruh-Qisthy-Press-.jpg;Al Qowam; Buku Sunnah
43;Buku Kado Pernikahan Qisthy Press ;10;548;67500;Baru;Buku Kado Pernikahan Qisthy Press .  Buku Sunnah. Qisthy Press;Tidak;j&tr | jner | tikir | wahana;https://alhaf.com/gambar/Qisthy-Press___Buku-Kado-Pernikahan-Qisthy-Press-.jpg;Al Qowam; Buku Sunnah
44;Buku La Tahzan Jangan Bersedih Qisthy Press ;8;1000;98300;Baru;Buku La Tahzan Jangan Bersedih Qisthy Press .  Buku Sunnah. Qisthy Press;Tidak;j&tr | jner | tikir | wahana;https://alhaf.com/gambar/Qisthy-Press___Buku-La-Tahzan-Jangan-Bersedih-Qisthy-Press-.jpg;Al Qowam; Buku Sunnah
45;Buku Menjadi Wanita Paling Bahagia Qisthy Press ;9;600;67500;Baru;Buku Menjadi Wanita Paling Bahagia Qisthy Press .  Buku Sunnah. Qisthy Press;Tidak;j&tr | jner | tikir | wahana;https://alhaf.com/gambar/Qisthy-Press___Buku-Menjadi-Wanita-Paling-Bahagia-Qisthy-Press-.jpg;Al Qowam; Buku Sunnah
46;Buku Qadha Dan Qadar Qisthy Press ;10;1100;129100;Baru;Buku Qadha Dan Qadar Qisthy Press .  Buku Sunnah. Qisthy Press;Tidak;j&tr | jner | tikir | wahana;https://alhaf.com/gambar/Qisthy-Press___Buku-Qadha-Dan-Qadar-Qisthy-Press-.jpg;Al Qowam; Buku Sunnah
47;Buku Sutra Ungu Sc Rumah Dzikir ;23;400;39900;Baru;Buku Sutra Ungu Sc Rumah Dzikir .  Buku Sunnah. Rumah Dzikir;Tidak;j&tr | jner | tikir | wahana;https://alhaf.com/gambar/Rumah-Dzikir___Buku-Sutra-Ungu-Sc-Rumah-Dzikir-.jpg;Al Qowam; Buku Sunnah
48;Buku Air Mata Buaya Penganut Syiah Rumah Ilmu ;28;500;76300;Baru;Buku Air Mata Buaya Penganut Syiah Rumah Ilmu .  Buku Sunnah. Rumah Ilmu;Tidak;j&tr | jner | tikir | wahana;https://alhaf.com/gambar/Rumah-Ilmu___Buku-Air-Mata-Buaya-Penganut-Syiah-Rumah-Ilmu-.jpg;Al Qowam; Buku Sunnah
49;Buku Dari Bangsawan Menjadi Jutawan Rumah Ilmu ;1;600;55700;Baru;Buku Dari Bangsawan Menjadi Jutawan Rumah Ilmu .  Buku Sunnah. Rumah Ilmu;Tidak;j&tr | jner | tikir | wahana;https://alhaf.com/gambar/Rumah-Ilmu___Buku-Dari-Bangsawan-Menjadi-Jutawan-Rumah-Ilmu-.jpg;Al Qowam; Buku Sunnah
50;Buku Ikhlaskan Ibadahmu Kepada Allah Rumah Ilmu ;2;200;26800;Baru;Buku Ikhlaskan Ibadahmu Kepada Allah Rumah Ilmu .  Buku Sunnah. Rumah Ilmu;Tidak;j&tr | jner | tikir | wahana;https://alhaf.com/gambar/Rumah-Ilmu___Buku-Ikhlaskan-Ibadahmu-Kepada-Allah-Rumah-Ilmu-.jpg;Al Qowam; Buku Sunnah
51;Buku Mencetak Generasi Rabbani Rumah Ilmu ;12;400;12800;Baru;Buku Mencetak Generasi Rabbani Rumah Ilmu .  Buku Sunnah. Rumah Ilmu;Tidak;j&tr | jner | tikir | wahana;https://alhaf.com/gambar/Rumah-Ilmu___Buku-Mencetak-Generasi-Rabbani-Rumah-Ilmu-.jpg;Al Qowam; Buku Sunnah
52;Buku Meraih Kebahagiaan Tanpa Batas Rumah Ilmu ;1;225;35000;Baru;Buku Meraih Kebahagiaan Tanpa Batas Rumah Ilmu .  Buku Sunnah. Rumah Ilmu;Tidak;j&tr | jner | tikir | wahana;https://alhaf.com/gambar/Rumah-Ilmu___Buku-Meraih-Kebahagiaan-Tanpa-Batas-Rumah-Ilmu-.jpg;Al Qowam; Buku Sunnah
53;Buku Pantaskah Selain Allah Disembah Hc Rumah Ilmu ;17;300;30900;Baru;Buku Pantaskah Selain Allah Disembah Hc Rumah Ilmu .  Buku Sunnah. Rumah Ilmu;Tidak;j&tr | jner | tikir | wahana;https://alhaf.com/gambar/Rumah-Ilmu___Buku-Pantaskah-Selain-Allah-Disembah-Hc-Rumah-Ilmu-.jpg;Al Qowam; Buku Sunnah
54;Buku Puncak Kemaha Indahan Asmaul Husna Rumah Ilmu ;1;150;26800;Baru;Buku Puncak Kemaha Indahan Asmaul Husna Rumah Ilmu .  Buku Sunnah. Rumah Ilmu;Tidak;j&tr | jner | tikir | wahana;https://alhaf.com/gambar/Rumah-Ilmu___Buku-Puncak-Kemaha-Indahan-Asmaul-Husna-Rumah-Ilmu-.jpg;Al Qowam; Buku Sunnah
55;Buku 50 Catatan Tentang Doa Plus 10 Doa Penting Problem Hidup Rumaysho ;28;155;29000;Baru;Buku 50 Catatan Tentang Doa Plus 10 Doa Penting Problem Hidup Rumaysho .  Buku Sunnah. Rumaysho;Tidak;j&tr | jner | tikir | wahana;https://alhaf.com/gambar/Rumaysho___Buku-50-Catatan-Tentang-Doa-Plus-10-Doa-Penting-Problem-Hidup-Rumaysho-.jpg;Al Qowam; Buku Sunnah
56;Buku 50 Doa Mengatasi Problem Hidup Rumaysho ;20;180;29000;Baru;Buku 50 Doa Mengatasi Problem Hidup Rumaysho .  Buku Sunnah. Rumaysho;Tidak;j&tr | jner | tikir | wahana;https://alhaf.com/gambar/Rumaysho___Buku-50-Doa-Mengatasi-Problem-Hidup-Rumaysho-.jpg;Al Qowam; Buku Sunnah
57;Buku Amalan Awal Dzulhijah Hingga Hari Tasyrik Rumaysho ;30;55;11300;Baru;Buku Amalan Awal Dzulhijah Hingga Hari Tasyrik Rumaysho .  Buku Sunnah. Rumaysho;Tidak;j&tr | jner | tikir | wahana;https://alhaf.com/gambar/Rumaysho___Buku-Amalan-Awal-Dzulhijah-Hingga-Hari-Tasyrik-Rumaysho-.jpg;Al Qowam; Buku Sunnah
58;Buku Amalan Pembuka Pintu Rezeki Rumaysho ;21;200;21300;Baru;Buku Amalan Pembuka Pintu Rezeki Rumaysho .  Buku Sunnah. Rumaysho;Tidak;j&tr | jner | tikir | wahana;https://alhaf.com/gambar/Rumaysho___Buku-Amalan-Pembuka-Pintu-Rezeki-Rumaysho-.jpg;Al Qowam; Buku Sunnah
59;Buku Belajar Dari Istri Nabi Rumaysho ;24;155;21300;Baru;Buku Belajar Dari Istri Nabi Rumaysho .  Buku Sunnah. Rumaysho;Tidak;j&tr | jner | tikir | wahana;https://alhaf.com/gambar/Rumaysho___Buku-Belajar-Dari-Istri-Nabi-Rumaysho-.jpg;Al Qowam; Buku Sunnah
60;Buku Belajar Qurban Sesuai Tuntunan Nabi Rumaysho ;30;55;11300;Baru;Buku Belajar Qurban Sesuai Tuntunan Nabi Rumaysho .  Buku Sunnah. Rumaysho;Tidak;j&tr | jner | tikir | wahana;https://alhaf.com/gambar/Rumaysho___Buku-Belajar-Qurban-Sesuai-Tuntunan-Nabi-Rumaysho-.jpg;Al Qowam; Buku Sunnah
61;Buku Dia Tak Lagi Setia Rumaysho ;22;350;29000;Baru;Buku Dia Tak Lagi Setia Rumaysho .  Buku Sunnah. Rumaysho;Tidak;j&tr | jner | tikir | wahana;https://alhaf.com/gambar/Rumaysho___Buku-Dia-Tak-Lagi-Setia-Rumaysho-.jpg;Al Qowam; Buku Sunnah
62;Buku Dzikir Pagi Petang Rumaysho ;106;100;12100;Baru;Buku Dzikir Pagi Petang Rumaysho .  Buku Sunnah. Rumaysho;Tidak;j&tr | jner | tikir | wahana;https://alhaf.com/gambar/Rumaysho___Buku-Dzikir-Pagi-Petang-Rumaysho-.jpg;Al Qowam; Buku Sunnah
63;Buku Jangan Pandang Masa Lalunya Rumaysho ;19;70;12100;Baru;Buku Jangan Pandang Masa Lalunya Rumaysho .  Buku Sunnah. Rumaysho;Tidak;j&tr | jner | tikir | wahana;https://alhaf.com/gambar/Rumaysho___Buku-Jangan-Pandang-Masa-Lalunya-Rumaysho-.jpg;Al Qowam; Buku Sunnah
64;Buku Mahasantri Rumaysho ;14;600;138400;Baru;Buku Mahasantri Rumaysho .  Buku Sunnah. Rumaysho;Tidak;j&tr | jner | tikir | wahana;https://alhaf.com/gambar/Rumaysho___Buku-Mahasantri-Rumaysho-.jpg;Al Wafi Publishing; Buku Sunnah
65;Buku Meninggalkan Shalat Lebih Parah Dari Pada Selingkuh Rumaysho ;20;250;22800;Baru;Buku Meninggalkan Shalat Lebih Parah Dari Pada Selingkuh Rumaysho .  Buku Sunnah. Rumaysho;Tidak;j&tr | jner | tikir | wahana;https://alhaf.com/gambar/Rumaysho___Buku-Meninggalkan-Shalat-Lebih-Parah-Dari-Pada-Selingkuh-Rumaysho-.jpg;Al Wafi Publishing; Buku Sunnah
66;Buku Mereka Yang Merugi Rumaysho ;1;75;10500;Baru;Buku Mereka Yang Merugi Rumaysho .  Buku Sunnah. Rumaysho;Tidak;j&tr | jner | tikir | wahana;https://alhaf.com/gambar/Rumaysho___Buku-Mereka-Yang-Merugi-Rumaysho-.jpg;Al Wafi Publishing; Buku Sunnah
67;Buku Muslim Tapi Musyrik Rumaysho ;25;300;29000;Baru;Buku Muslim Tapi Musyrik Rumaysho .  Buku Sunnah. Rumaysho;Tidak;j&tr | jner | tikir | wahana;https://alhaf.com/gambar/Rumaysho___Buku-Muslim-Tapi-Musyrik-Rumaysho-.jpg;Al Wafi Publishing; Buku Sunnah
68;Buku Panduan Ramadhan Kontemporer Rumaysho ;13;595;118900;Baru;Buku Panduan Ramadhan Kontemporer Rumaysho .  Buku Sunnah. Rumaysho;Tidak;j&tr | jner | tikir | wahana;https://alhaf.com/gambar/Rumaysho___Buku-Panduan-Ramadhan-Kontemporer-Rumaysho-.jpg;Al Wafi Publishing; Buku Sunnah
69;Buku Pesugihan Rumaysho ;22;80;13600;Baru;Buku Pesugihan Rumaysho .  Buku Sunnah. Rumaysho;Tidak;j&tr | jner | tikir | wahana;https://alhaf.com/gambar/Rumaysho___Buku-Pesugihan-Rumaysho-.jpg;Al Wafi Publishing; Buku Sunnah
70;Buku Sembilan Mutiara Faedah Tersembunyi Dari Hadits Nama Dan Sifat Allah Rumaysho ;48;180;25100;Baru;Buku Sembilan Mutiara Faedah Tersembunyi Dari Hadits Nama Dan Sifat Allah Rumaysho .  Buku Sunnah. Rumaysho;Tidak;j&tr | jner | tikir | wahana;https://alhaf.com/gambar/Rumaysho___Buku-Sembilan-Mutiara-Faedah-Tersembunyi-Dari-Hadits-Nama-Dan-Sifat-Allah-Rumaysho-.jpg;Al Wafi Publishing; Buku Sunnah
71;Buku Seret Rezeki Susah Jodoh Rumaysho ;33;20;9000;Baru;Buku Seret Rezeki Susah Jodoh Rumaysho .  Buku Sunnah. Rumaysho;Tidak;j&tr | jner | tikir | wahana;https://alhaf.com/gambar/Rumaysho___Buku-Seret-Rezeki-Susah-Jodoh-Rumaysho-.jpg;Al Wafi Publishing; Buku Sunnah
72;Buku Siap Dipinang Rumaysho ;37;70;12100;Baru;Buku Siap Dipinang Rumaysho .  Buku Sunnah. Rumaysho;Tidak;j&tr | jner | tikir | wahana;https://alhaf.com/gambar/Rumaysho___Buku-Siap-Dipinang-Rumaysho-.jpg;Alfasyam; Buku Sunnah
73;Buku Engkau Lebih Cantik Dengan Jilbab Samudera ;18;200;26700;Baru;Buku Engkau Lebih Cantik Dengan Jilbab Samudera .  Buku Sunnah. Samudera;Tidak;j&tr | jner | tikir | wahana;https://alhaf.com/gambar/Samudera___Buku-Engkau-Lebih-Cantik-Dengan-Jilbab-Samudera-.jpg;AMM Yogyakarta; Buku Sunnah
74;Buku Golden Manners Samudera ;11;300;48200;Baru;Buku Golden Manners Samudera .  Buku Sunnah. Samudera;Tidak;j&tr | jner | tikir | wahana;https://alhaf.com/gambar/Samudera___Buku-Golden-Manners-Samudera-.jpg;An Naba; Buku Sunnah
75;Buku Menjadi Istri Penuh Pesona Samudera ;14;285;25100;Baru;Buku Menjadi Istri Penuh Pesona Samudera .  Buku Sunnah. Samudera;Tidak;j&tr | jner | tikir | wahana;https://alhaf.com/gambar/Samudera___Buku-Menjadi-Istri-Penuh-Pesona-Samudera-.jpg;Aqwam; Buku Sunnah
76;Buku Temukan Aku Dalam Istikharahmu Samudera ;12;200;26700;Baru;Buku Temukan Aku Dalam Istikharahmu Samudera .  Buku Sunnah. Samudera;Tidak;j&tr | jner | tikir | wahana;https://alhaf.com/gambar/Samudera___Buku-Temukan-Aku-Dalam-Istikharahmu-Samudera-.jpg;Aqwam; Buku Sunnah
77;Buku Ya Allah Aku Ingin Menikah Samudera ;20;300;29800;Baru;Buku Ya Allah Aku Ingin Menikah Samudera .  Buku Sunnah. Samudera;Tidak;j&tr | jner | tikir | wahana;https://alhaf.com/gambar/Samudera___Buku-Ya-Allah-Aku-Ingin-Menikah-Samudera-.jpg;Aqwam; Buku Sunnah
78;Buku Ya Allah Aku Jatuh Cinta Samudera ;19;150;25100;Baru;Buku Ya Allah Aku Jatuh Cinta Samudera .  Buku Sunnah. Samudera;Tidak;j&tr | jner | tikir | wahana;https://alhaf.com/gambar/Samudera___Buku-Ya-Allah-Aku-Jatuh-Cinta-Samudera-.jpg;Aqwam; Buku Sunnah
79;Buku Ya Allah Aku Tak Ingin Sendiri Samudera ;22;200;28200;Baru;Buku Ya Allah Aku Tak Ingin Sendiri Samudera .  Buku Sunnah. Samudera;Tidak;j&tr | jner | tikir | wahana;https://alhaf.com/gambar/Samudera___Buku-Ya-Allah-Aku-Tak-Ingin-Sendiri-Samudera-.jpg;Aqwam; Buku Sunnah
80;Buku Ya Allah Izinkan Dia Untukku Samudera ;20;200;25100;Baru;Buku Ya Allah Izinkan Dia Untukku Samudera .  Buku Sunnah. Samudera;Tidak;j&tr | jner | tikir | wahana;https://alhaf.com/gambar/Samudera___Buku-Ya-Allah-Izinkan-Dia-Untukku-Samudera-.jpg;Aqwam; Buku Sunnah
81;Buku Imam Syafii Menggugat Syafiiyyah Shafa Publika ;14;420;48200;Baru;Buku Imam Syafii Menggugat Syafiiyyah Shafa Publika .  Buku Sunnah. Shafa Publika;Tidak;j&tr | jner | tikir | wahana;https://alhaf.com/gambar/Shafa-Publika___Buku-Imam-Syafii-Menggugat-Syafiiyyah-Shafa-Publika-.jpg;Aqwam; Buku Sunnah
82;Buku Keajaiban Bulan Ramadhan Shafa Publika ;9;350;39800;Baru;Buku Keajaiban Bulan Ramadhan Shafa Publika .  Buku Sunnah. Shafa Publika;Tidak;j&tr | jner | tikir | wahana;https://alhaf.com/gambar/Shafa-Publika___Buku-Keajaiban-Bulan-Ramadhan-Shafa-Publika-.jpg;Aqwam; Buku Sunnah
83;Buku Kedokteran Nabi Shafa Publika ;8;600;94400;Baru;Buku Kedokteran Nabi Shafa Publika .  Buku Sunnah. Shafa Publika;Tidak;j&tr | jner | tikir | wahana;https://alhaf.com/gambar/Shafa-Publika___Buku-Kedokteran-Nabi-Shafa-Publika-.jpg;Aqwam; Buku Sunnah
84;Buku Mati Tersenyum Esok Pagi Shafa Publika ;7;300;31300;Baru;Buku Mati Tersenyum Esok Pagi Shafa Publika .  Buku Sunnah. Shafa Publika;Tidak;j&tr | jner | tikir | wahana;https://alhaf.com/gambar/Shafa-Publika___Buku-Mati-Tersenyum-Esok-Pagi-Shafa-Publika-.jpg;Aqwam; Buku Sunnah
85;Buku Meniti Di Atas Kabut -Sandiwara Langit 2- Shafa Publika ;5;400;35900;Baru;Buku Meniti Di Atas Kabut (Sandiwara Langit 2) Shafa Publika .  Buku Sunnah. Shafa Publika;Tidak;j&tr | jner | tikir | wahana;https://alhaf.com/gambar/Shafa-Publika___Buku-Meniti-Di-Atas-Kabut-(Sandiwara-Langit-2)-Shafa-Publika-.jpg;Aqwam; Buku Sunnah
86;Buku Orang Gila Jadi Wali Shafa Publika ;8;300;36700;Baru;Buku Orang Gila Jadi Wali Shafa Publika .  Buku Sunnah. Shafa Publika;Tidak;j&tr | jner | tikir | wahana;https://alhaf.com/gambar/Shafa-Publika___Buku-Orang-Gila-Jadi-Wali-Shafa-Publika-.jpg;Aqwam; Buku Sunnah
87;Buku Prahara Cinta Sebuah Kisah Asmara Yang Menguji Iman Shafa Publika ;7;410;44400;Baru;Buku Prahara Cinta Sebuah Kisah Asmara Yang Menguji Iman Shafa Publika .  Buku Sunnah. Shafa Publika;Tidak;j&tr | jner | tikir | wahana;https://alhaf.com/gambar/Shafa-Publika___Buku-Prahara-Cinta-Sebuah-Kisah-Asmara-Yang-Menguji-Iman-Shafa-Publika-.jpg;Aqwam; Buku Sunnah
